02/11/2024 09:52:10	Ether / IP / TCP 192.168.29.3:60522 > 119.63.197.139:http S		
02/11/2024 09:52:11	Ether / IP / TCP 192.168.29.3:60523 > 119.63.197.139:http S		
02/11/2024 09:52:11	Ether / IP / TCP 119.63.197.139:http > 192.168.29.3:60522 SA		
02/11/2024 09:52:11	Ether / IP / TCP 192.168.29.3:60522 > 119.63.197.139:http A		
02/11/2024 09:52:11	Ether / IP / TCP / HTTP / GET '/' 		
02/11/2024 09:52:11	Ether / IP / TCP 119.63.197.139:http > 192.168.29.3:60523 SA		
02/11/2024 09:52:11	Ether / IP / TCP 192.168.29.3:60523 > 119.63.197.139:http A		
02/11/2024 09:52:11	Ether / IP / TCP 119.63.197.139:http > 192.168.29.3:60522 A		
02/11/2024 09:52:11	Ether / IP / TCP / HTTP / 200 OK / Raw		
02/11/2024 09:52:11	Ether / IP / TCP 192.168.29.3:60522 > 119.63.197.139:http A		
02/11/2024 09:52:11	Ether / IP / TCP 119.63.197.139:http > 192.168.29.3:60522 A / HTTP / Raw		
02/11/2024 09:52:11	Ether / IP / TCP 119.63.197.139:http > 192.168.29.3:60522 PA / HTTP / Raw		
02/11/2024 09:52:11	Ether / IP / TCP 192.168.29.3:60522 > 119.63.197.139:http A		
02/11/2024 09:52:11	Ether / IP / TCP 119.63.197.139:http > 192.168.29.3:60522 A / HTTP / Raw		
02/11/2024 09:52:11	Ether / IP / TCP 192.168.29.3:60522 > 119.63.197.139:http A		
02/11/2024 09:52:11	Ether / IP / TCP 119.63.197.139:http > 192.168.29.3:60522 A / HTTP / Raw		
02/11/2024 09:52:11	Ether / IP / TCP 192.168.29.3:60522 > 119.63.197.139:http A		
02/11/2024 09:52:11	Ether / IP / TCP 119.63.197.139:http > 192.168.29.3:60522 A / HTTP / Raw		
02/11/2024 09:52:11	Ether / IP / TCP 192.168.29.3:60522 > 119.63.197.139:http A		
02/11/2024 09:52:11	Ether / IP / TCP 119.63.197.139:http > 192.168.29.3:60522 A / HTTP / Raw		
02/11/2024 09:52:11	Ether / IP / TCP 119.63.197.139:http > 192.168.29.3:60522 A / HTTP / Raw		
02/11/2024 09:52:11	Ether / IP / TCP 119.63.197.139:http > 192.168.29.3:60522 A / HTTP / Raw		
02/11/2024 09:52:11	Ether / IP / TCP 192.168.29.3:60522 > 119.63.197.139:http A		
02/11/2024 09:52:11	Ether / IP / TCP 192.168.29.3:60522 > 119.63.197.139:http A		
02/11/2024 09:52:11	Ether / IP / TCP 119.63.197.139:http > 192.168.29.3:60522 A / HTTP / Raw		
02/11/2024 09:52:11	Ether / IP / TCP 119.63.197.139:http > 192.168.29.3:60522 A / HTTP / Raw		
02/11/2024 09:52:11	Ether / IP / TCP 192.168.29.3:60522 > 119.63.197.139:http A		
02/11/2024 09:52:11	Ether / IP / TCP 192.168.29.3:60522 > 119.63.197.139:http A		
02/11/2024 09:52:11	Ether / IP / TCP 119.63.197.139:http > 192.168.29.3:60522 PA / HTTP / Raw		
02/11/2024 09:52:11	Ether / IP / TCP 119.63.197.139:http > 192.168.29.3:60522 A / HTTP / Raw		
02/11/2024 09:52:11	Ether / IP / TCP 119.63.197.139:http > 192.168.29.3:60522 PA / HTTP / Raw		
02/11/2024 09:52:11	Ether / IP / TCP 192.168.29.3:60522 > 119.63.197.139:http A		
02/11/2024 09:52:11	Ether / IP / TCP 119.63.197.139:http > 192.168.29.3:60522 PA / HTTP / Raw		
02/11/2024 09:52:11	Ether / IP / TCP 192.168.29.3:60522 > 119.63.197.139:http A		
02/11/2024 09:52:11	Ether / IP / TCP 119.63.197.139:http > 192.168.29.3:60522 A / HTTP / Raw		
02/11/2024 09:52:11	Ether / IP / TCP 192.168.29.3:60522 > 119.63.197.139:http A		
02/11/2024 09:52:11	Ether / IP / TCP 119.63.197.139:http > 192.168.29.3:60522 A / HTTP / Raw		
02/11/2024 09:52:11	Ether / IP / TCP 192.168.29.3:60522 > 119.63.197.139:http A		
02/11/2024 09:52:11	Ether / IP / TCP 119.63.197.139:http > 192.168.29.3:60522 PA / HTTP / Raw		
02/11/2024 09:52:11	Ether / IP / TCP 119.63.197.139:http > 192.168.29.3:60522 A / HTTP / Raw		
02/11/2024 09:52:11	Ether / IP / TCP 192.168.29.3:60522 > 119.63.197.139:http A		
02/11/2024 09:52:11	Ether / IP / TCP 119.63.197.139:http > 192.168.29.3:60522 A / HTTP / Raw		
02/11/2024 09:52:11	Ether / IP / TCP 192.168.29.3:60522 > 119.63.197.139:http A		
02/11/2024 09:52:11	Ether / IP / TCP 119.63.197.139:http > 192.168.29.3:60522 A / HTTP / Raw		
02/11/2024 09:52:11	Ether / IP / TCP 119.63.197.139:http > 192.168.29.3:60522 A / HTTP / Raw		
02/11/2024 09:52:11	Ether / IP / TCP 192.168.29.3:60522 > 119.63.197.139:http A		
02/11/2024 09:52:11	Ether / IP / TCP 192.168.29.3:60522 > 119.63.197.139:http A		
02/11/2024 09:52:11	Ether / IP / TCP 119.63.197.139:http > 192.168.29.3:60522 PA / HTTP / Raw		
02/11/2024 09:52:11	Ether / IP / TCP 192.168.29.3:60522 > 119.63.197.139:http A		
02/11/2024 09:52:11	Ether / IP / TCP 119.63.197.139:http > 192.168.29.3:60522 A / HTTP / Raw		
02/11/2024 09:52:11	Ether / IP / TCP 119.63.197.139:http > 192.168.29.3:60522 A / HTTP / Raw		
02/11/2024 09:52:11	Ether / IP / TCP 119.63.197.139:http > 192.168.29.3:60522 PA / HTTP / Raw		
02/11/2024 09:52:11	Ether / IP / TCP 192.168.29.3:60522 > 119.63.197.139:http A		
02/11/2024 09:52:11	Ether / IP / TCP 119.63.197.139:http > 192.168.29.3:60522 PA / HTTP / Raw		
02/11/2024 09:52:11	Ether / IP / TCP 119.63.197.139:http > 192.168.29.3:60522 A / HTTP / Raw		
02/11/2024 09:52:11	Ether / IP / TCP 192.168.29.3:60522 > 119.63.197.139:http A		
02/11/2024 09:52:11	Ether / IP / TCP / HTTP / 200 OK / Raw		
02/11/2024 09:52:11	Ether / IP / TCP 192.168.29.3:60522 > 119.63.197.139:http A		
02/11/2024 09:52:11	Ether / IP / TCP 119.63.197.139:http > 192.168.29.3:60522 A / HTTP / Raw		
02/11/2024 09:52:11	Ether / IP / TCP 192.168.29.3:60522 > 119.63.197.139:http A		
02/11/2024 09:52:11	Ether / IP / TCP 119.63.197.139:http > 192.168.29.3:60522 PA / HTTP / Raw		
02/11/2024 09:52:11	Ether / IP / TCP 192.168.29.3:60522 > 119.63.197.139:http A		
02/11/2024 09:52:11	Ether / IP / TCP 119.63.197.139:http > 192.168.29.3:60522 A / HTTP / Raw		
02/11/2024 09:52:11	Ether / IP / TCP 192.168.29.3:60522 > 119.63.197.139:http A		
02/11/2024 09:52:11	Ether / IP / TCP 119.63.197.139:http > 192.168.29.3:60522 A / HTTP / Raw		
02/11/2024 09:52:11	Ether / IP / TCP 119.63.197.139:http > 192.168.29.3:60522 A / HTTP / Raw		
02/11/2024 09:52:11	Ether / IP / TCP 192.168.29.3:60522 > 119.63.197.139:http A		
02/11/2024 09:52:11	Ether / IP / TCP 119.63.197.139:http > 192.168.29.3:60522 A / HTTP / Raw		
02/11/2024 09:52:11	Ether / IP / TCP 192.168.29.3:60522 > 119.63.197.139:http A		
02/11/2024 09:52:11	Ether / IP / TCP 119.63.197.139:http > 192.168.29.3:60522 A / HTTP / Raw		
02/11/2024 09:52:11	Ether / IP / TCP 119.63.197.139:http > 192.168.29.3:60522 A / HTTP / Raw		
02/11/2024 09:52:11	Ether / IP / TCP 192.168.29.3:60522 > 119.63.197.139:http A		
02/11/2024 09:52:11	Ether / IP / TCP 119.63.197.139:http > 192.168.29.3:60522 A / HTTP / Raw		
02/11/2024 09:52:11	Ether / IP / TCP 119.63.197.139:http > 192.168.29.3:60522 A / HTTP / Raw		
02/11/2024 09:52:11	Ether / IP / TCP 192.168.29.3:60522 > 119.63.197.139:http A		
02/11/2024 09:52:11	Ether / IP / TCP 119.63.197.139:http > 192.168.29.3:60522 A / HTTP / Raw		
02/11/2024 09:52:11	Ether / IP / TCP 119.63.197.139:http > 192.168.29.3:60522 A / HTTP / Raw		
02/11/2024 09:52:11	Ether / IP / TCP 192.168.29.3:60522 > 119.63.197.139:http A		
02/11/2024 09:52:11	Ether / IP / TCP 119.63.197.139:http > 192.168.29.3:60522 A / HTTP / Raw		
02/11/2024 09:52:11	Ether / IP / TCP 119.63.197.139:http > 192.168.29.3:60522 A / HTTP / Raw		
02/11/2024 09:52:11	Ether / IP / TCP 192.168.29.3:60522 > 119.63.197.139:http A		
02/11/2024 09:52:11	Ether / IP / TCP 119.63.197.139:http > 192.168.29.3:60522 A / HTTP / Raw		
02/11/2024 09:52:11	Ether / IP / TCP 119.63.197.139:http > 192.168.29.3:60522 A / HTTP / Raw		
02/11/2024 09:52:11	Ether / IP / TCP 119.63.197.139:http > 192.168.29.3:60522 A / HTTP / Raw		
02/11/2024 09:52:11	Ether / IP / TCP 192.168.29.3:60522 > 119.63.197.139:http A		
02/11/2024 09:52:11	Ether / IP / TCP 119.63.197.139:http > 192.168.29.3:60522 A / HTTP / Raw		
02/11/2024 09:52:11	Ether / IP / TCP 119.63.197.139:http > 192.168.29.3:60522 A / HTTP / Raw		
02/11/2024 09:52:11	Ether / IP / TCP 192.168.29.3:60522 > 119.63.197.139:http A		
02/11/2024 09:52:11	Ether / IP / TCP 119.63.197.139:http > 192.168.29.3:60522 A / HTTP / Raw		
02/11/2024 09:52:11	Ether / IP / TCP 119.63.197.139:http > 192.168.29.3:60522 A / HTTP / Raw		
02/11/2024 09:52:11	Ether / IP / TCP 119.63.197.139:http > 192.168.29.3:60522 A / HTTP / Raw		
02/11/2024 09:52:11	Ether / IP / TCP 192.168.29.3:60522 > 119.63.197.139:http A		
02/11/2024 09:52:11	Ether / IP / TCP 119.63.197.139:http > 192.168.29.3:60522 A / HTTP / Raw		
02/11/2024 09:52:11	Ether / IP / TCP 119.63.197.139:http > 192.168.29.3:60522 A / HTTP / Raw		
02/11/2024 09:52:11	Ether / IP / TCP 192.168.29.3:60522 > 119.63.197.139:http A		
02/11/2024 09:52:11	Ether / IP / TCP 119.63.197.139:http > 192.168.29.3:60522 A / HTTP / Raw		
02/11/2024 09:52:11	Ether / IP / TCP 119.63.197.139:http > 192.168.29.3:60522 A / HTTP / Raw		
02/11/2024 09:52:11	Ether / IP / TCP 119.63.197.139:http > 192.168.29.3:60522 A / HTTP / Raw		
02/11/2024 09:52:11	Ether / IP / TCP 192.168.29.3:60522 > 119.63.197.139:http A		
02/11/2024 09:52:11	Ether / IP / TCP 119.63.197.139:http > 192.168.29.3:60522 A / HTTP / Raw		
02/11/2024 09:52:11	Ether / IP / TCP 119.63.197.139:http > 192.168.29.3:60522 A / HTTP / Raw		
02/11/2024 09:52:11	Ether / IP / TCP 192.168.29.3:60522 > 119.63.197.139:http A		
02/11/2024 09:52:11	Ether / IP / TCP 119.63.197.139:http > 192.168.29.3:60522 A / HTTP / Raw		
02/11/2024 09:52:11	Ether / IP / TCP 119.63.197.139:http > 192.168.29.3:60522 A / HTTP / Raw		
02/11/2024 09:52:11	Ether / IP / TCP 119.63.197.139:http > 192.168.29.3:60522 A / HTTP / Raw		
02/11/2024 09:52:11	Ether / IP / TCP 192.168.29.3:60522 > 119.63.197.139:http A		
02/11/2024 09:52:11	Ether / IP / TCP 119.63.197.139:http > 192.168.29.3:60522 A / HTTP / Raw		
02/11/2024 09:52:11	Ether / IP / TCP 119.63.197.139:http > 192.168.29.3:60522 A / HTTP / Raw		
02/11/2024 09:52:11	Ether / IP / TCP 192.168.29.3:60522 > 119.63.197.139:http A		
02/11/2024 09:52:11	Ether / IP / TCP 119.63.197.139:http > 192.168.29.3:60522 A / HTTP / Raw		
02/11/2024 09:52:11	Ether / IP / TCP 119.63.197.139:http > 192.168.29.3:60522 A / HTTP / Raw		
02/11/2024 09:52:11	Ether / IP / TCP 119.63.197.139:http > 192.168.29.3:60522 A / HTTP / Raw		
02/11/2024 09:52:11	Ether / IP / TCP 192.168.29.3:60522 > 119.63.197.139:http A		
02/11/2024 09:52:11	Ether / IP / TCP 119.63.197.139:http > 192.168.29.3:60522 A / HTTP / Raw		
02/11/2024 09:52:11	Ether / IP / TCP 119.63.197.139:http > 192.168.29.3:60522 A / HTTP / Raw		
02/11/2024 09:52:11	Ether / IP / TCP 192.168.29.3:60522 > 119.63.197.139:http A		
02/11/2024 09:52:11	Ether / IP / TCP 119.63.197.139:http > 192.168.29.3:60522 A / HTTP / Raw		
02/11/2024 09:52:11	Ether / IP / TCP 119.63.197.139:http > 192.168.29.3:60522 A / HTTP / Raw		
02/11/2024 09:52:11	Ether / IP / TCP 192.168.29.3:60522 > 119.63.197.139:http A		
02/11/2024 09:52:11	Ether / IP / TCP 119.63.197.139:http > 192.168.29.3:60522 A / HTTP / Raw		
02/11/2024 09:52:11	Ether / IP / TCP 119.63.197.139:http > 192.168.29.3:60522 A / HTTP / Raw		
02/11/2024 09:52:11	Ether / IP / TCP 119.63.197.139:http > 192.168.29.3:60522 A / HTTP / Raw		
02/11/2024 09:52:11	Ether / IP / TCP 192.168.29.3:60522 > 119.63.197.139:http A		
02/11/2024 09:52:11	Ether / IP / TCP 119.63.197.139:http > 192.168.29.3:60522 A / HTTP / Raw		
02/11/2024 09:52:11	Ether / IP / TCP 119.63.197.139:http > 192.168.29.3:60522 A / HTTP / Raw		
02/11/2024 09:52:11	Ether / IP / TCP 119.63.197.139:http > 192.168.29.3:60522 A / HTTP / Raw		
02/11/2024 09:52:11	Ether / IP / TCP 192.168.29.3:60522 > 119.63.197.139:http A		
02/11/2024 09:52:11	Ether / IP / TCP 119.63.197.139:http > 192.168.29.3:60522 A / HTTP / Raw		
02/11/2024 09:52:11	Ether / IP / TCP 119.63.197.139:http > 192.168.29.3:60522 A / HTTP / Raw		
02/11/2024 09:52:11	Ether / IP / TCP 192.168.29.3:60522 > 119.63.197.139:http A		
02/11/2024 09:52:11	Ether / IP / TCP 119.63.197.139:http > 192.168.29.3:60522 A / HTTP / Raw		
02/11/2024 09:52:11	Ether / IP / TCP 119.63.197.139:http > 192.168.29.3:60522 A / HTTP / Raw		
02/11/2024 09:52:11	Ether / IP / TCP 119.63.197.139:http > 192.168.29.3:60522 A / HTTP / Raw		
02/11/2024 09:52:11	Ether / IP / TCP 192.168.29.3:60522 > 119.63.197.139:http A		
02/11/2024 09:52:11	Ether / IP / TCP 119.63.197.139:http > 192.168.29.3:60522 A / HTTP / Raw		
02/11/2024 09:52:11	Ether / IP / TCP 119.63.197.139:http > 192.168.29.3:60522 A / HTTP / Raw		
02/11/2024 09:52:11	Ether / IP / TCP 119.63.197.139:http > 192.168.29.3:60522 PA / HTTP / Raw		
02/11/2024 09:52:11	Ether / IP / TCP 192.168.29.3:60522 > 119.63.197.139:http A		
02/11/2024 09:52:11	Ether / IP / TCP 192.168.29.3:60525 > 61.170.110.38:http S		
02/11/2024 09:52:11	Ether / IP / TCP 192.168.29.3:60528 > 61.170.110.38:http S		
02/11/2024 09:52:12	Ether / IP / TCP 61.170.110.38:http > 192.168.29.3:60528 SA		
02/11/2024 09:52:12	Ether / IP / TCP 61.170.110.38:http > 192.168.29.3:60525 SA		
02/11/2024 09:52:12	Ether / IP / TCP 192.168.29.3:60528 > 61.170.110.38:http A		
02/11/2024 09:52:12	Ether / IP / TCP 192.168.29.3:60525 > 61.170.110.38:http A		
02/11/2024 09:52:12	Ether / IP / TCP / HTTP / GET '/cd37ed75a9387c5b.js' 		
02/11/2024 09:52:12	Ether / IP / TCP 61.170.110.38:http > 192.168.29.3:60528 SA		
02/11/2024 09:52:12	Ether / IP / TCP 61.170.110.38:http > 192.168.29.3:60525 SA		
02/11/2024 09:52:12	Ether / IP / TCP 192.168.29.3:60528 > 61.170.110.38:http A		
02/11/2024 09:52:12	Ether / IP / TCP 192.168.29.3:60525 > 61.170.110.38:http A		
02/11/2024 09:52:12	Ether / IP / TCP 61.170.110.38:http > 192.168.29.3:60525 SA		
02/11/2024 09:52:12	Ether / IP / TCP 61.170.110.38:http > 192.168.29.3:60528 SA		
02/11/2024 09:52:12	Ether / IP / TCP 192.168.29.3:60525 > 61.170.110.38:http A		
02/11/2024 09:52:12	Ether / IP / TCP 192.168.29.3:60528 > 61.170.110.38:http A		
02/11/2024 09:52:12	Ether / IP / TCP 61.170.110.38:http > 192.168.29.3:60528 A		
02/11/2024 09:52:12	Ether / IP / TCP / HTTP / 304 Not Modified		
02/11/2024 09:52:12	Ether / IP / TCP 192.168.29.3:60528 > 61.170.110.38:http A		
02/11/2024 09:52:12	Ether / IP / TCP / HTTP / 304 Not Modified		
02/11/2024 09:52:12	Ether / IP / TCP 192.168.29.3:60528 > 61.170.110.38:http A		
02/11/2024 09:52:12	Ether / IP / TCP / HTTP / GET '/sugrec?&prod=pc_his&from=pc_web&json=1&sid=60274_60854_61007_61027_61021&hisdata=&_t=1730501532831&req=2&csor=0' 		
02/11/2024 09:52:12	Ether / IP / TCP 192.168.29.3:60531 > 45.113.194.250:http S		
02/11/2024 09:52:13	Ether / IP / TCP 45.113.194.250:http > 192.168.29.3:60531 SA		
02/11/2024 09:52:13	Ether / IP / TCP 192.168.29.3:60531 > 45.113.194.250:http A		
02/11/2024 09:52:13	Ether / IP / TCP / HTTP / GET '/passApi/js/wrapper.js?cdnversion=1730501532847&_=1730501531625' 		
02/11/2024 09:52:13	Ether / IP / TCP 119.63.197.139:http > 192.168.29.3:60522 A		
02/11/2024 09:52:13	Ether / IP / TCP / HTTP / 200 OK / Raw		
02/11/2024 09:52:13	Ether / IP / TCP 192.168.29.3:60522 > 119.63.197.139:http A		
02/11/2024 09:52:13	Ether / IP / TCP 45.113.194.250:http > 192.168.29.3:60531 A		
02/11/2024 09:52:13	Ether / IP / TCP / HTTP / 200 OK		
02/11/2024 09:52:13	Ether / IP / TCP 192.168.29.3:60531 > 45.113.194.250:http A		
02/11/2024 09:52:13	Ether / IP / TCP 45.113.194.250:http > 192.168.29.3:60531 A / HTTP / Raw		
02/11/2024 09:52:13	Ether / IP / TCP 45.113.194.250:http > 192.168.29.3:60531 PA / HTTP / Raw		
02/11/2024 09:52:13	Ether / IP / TCP 192.168.29.3:60531 > 45.113.194.250:http A		
02/11/2024 09:52:13	Ether / IP / TCP 45.113.194.250:http > 192.168.29.3:60531 PA / HTTP / Raw		
02/11/2024 09:52:13	Ether / IP / TCP 192.168.29.3:60531 > 45.113.194.250:http A		
02/11/2024 09:52:13	Ether / IP / TCP 45.113.194.250:http > 192.168.29.3:60531 A / HTTP / Raw		
02/11/2024 09:52:13	Ether / IP / TCP 45.113.194.250:http > 192.168.29.3:60531 A / HTTP / Raw		
02/11/2024 09:52:13	Ether / IP / TCP 192.168.29.3:60531 > 45.113.194.250:http A		
02/11/2024 09:52:13	Ether / IP / TCP 45.113.194.250:http > 192.168.29.3:60531 PA / HTTP / Raw		
02/11/2024 09:52:13	Ether / IP / TCP 45.113.194.250:http > 192.168.29.3:60531 PA / HTTP / Raw		
02/11/2024 09:52:13	Ether / IP / TCP 45.113.194.250:http > 192.168.29.3:60531 PA / HTTP / Raw		
02/11/2024 09:52:13	Ether / IP / TCP 192.168.29.3:60531 > 45.113.194.250:http A		
02/11/2024 09:52:13	Ether / IP / TCP 192.168.29.3:60531 > 45.113.194.250:http A		
02/11/2024 09:52:13	Ether / IP / TCP 45.113.194.250:http > 192.168.29.3:60531 PA / HTTP / Raw		
02/11/2024 09:52:13	Ether / IP / TCP 192.168.29.3:60531 > 45.113.194.250:http A		
02/11/2024 10:20:22	en0	Ether / IP / TCP 192.168.1.101:60747 > 129.94.254.36:http SEC	
02/11/2024 10:20:23	en0	Ether / IP / TCP 192.168.1.101:60747 > 129.94.254.36:http S	
02/11/2024 10:20:24	en0	Ether / IP / TCP 192.168.1.101:60747 > 129.94.254.36:http S	
02/11/2024 10:20:25	en0	Ether / IP / TCP 192.168.1.101:60747 > 129.94.254.36:http S	
02/11/2024 10:20:26	en0	Ether / IP / TCP 192.168.1.101:62838 > 192.168.1.1:http SEC	
02/11/2024 10:20:26	en0	Ether / IP / TCP 192.168.1.1:http > 192.168.1.101:62838 SAE	
02/11/2024 10:20:26	en0	Ether / IP / TCP 192.168.1.101:62838 > 192.168.1.1:http A	
02/11/2024 10:20:26	en0	Ether / IP / TCP / HTTP / GET '/' 	
02/11/2024 10:20:26	en0	Ether / IP / TCP 192.168.1.1:http > 192.168.1.101:62838 A	
02/11/2024 10:20:26	en0	Ether / IP / TCP / HTTP / 200 OK	
02/11/2024 10:20:26	en0	Ether / IP / TCP 192.168.1.101:62838 > 192.168.1.1:http A	
02/11/2024 10:20:26	en0	Ether / IP / TCP 192.168.1.1:http > 192.168.1.101:62838 A / HTTP / Raw	
02/11/2024 10:20:26	en0	Ether / IP / TCP 192.168.1.1:http > 192.168.1.101:62838 A / HTTP / Raw	
02/11/2024 10:20:26	en0	Ether / IP / TCP 192.168.1.1:http > 192.168.1.101:62838 PA / HTTP / Raw	
02/11/2024 10:20:26	en0	Ether / IP / TCP 192.168.1.101:62838 > 192.168.1.1:http A	
02/11/2024 10:20:26	en0	Ether / IP / TCP 192.168.1.1:http > 192.168.1.101:62838 A / HTTP / Raw	
02/11/2024 10:20:26	en0	Ether / IP / TCP 192.168.1.1:http > 192.168.1.101:62838 A / HTTP / Raw	
02/11/2024 10:20:26	en0	Ether / IP / TCP 192.168.1.1:http > 192.168.1.101:62838 PA / HTTP / Raw	
02/11/2024 10:20:26	en0	Ether / IP / TCP 192.168.1.101:62838 > 192.168.1.1:http A	
02/11/2024 10:20:26	en0	Ether / IP / TCP 192.168.1.1:http > 192.168.1.101:62838 A / HTTP / Raw	
02/11/2024 10:20:26	en0	Ether / IP / TCP 192.168.1.1:http > 192.168.1.101:62838 A / HTTP / Raw	
02/11/2024 10:20:26	en0	Ether / IP / TCP 192.168.1.1:http > 192.168.1.101:62838 A / HTTP / Raw	
02/11/2024 10:20:26	en0	Ether / IP / TCP 192.168.1.101:62838 > 192.168.1.1:http A	
02/11/2024 10:20:26	en0	Ether / IP / TCP 192.168.1.1:http > 192.168.1.101:62838 A / HTTP / Raw	
02/11/2024 10:20:26	en0	Ether / IP / TCP 192.168.1.1:http > 192.168.1.101:62838 A / HTTP / Raw	
02/11/2024 10:20:26	en0	Ether / IP / TCP 192.168.1.1:http > 192.168.1.101:62838 A / HTTP / Raw	
02/11/2024 10:20:26	en0	Ether / IP / TCP 192.168.1.1:http > 192.168.1.101:62838 A / HTTP / Raw	
02/11/2024 10:20:26	en0	Ether / IP / TCP 192.168.1.1:http > 192.168.1.101:62838 A / HTTP / Raw	
02/11/2024 10:20:26	en0	Ether / IP / TCP 192.168.1.1:http > 192.168.1.101:62838 A / HTTP / Raw	
02/11/2024 10:20:26	en0	Ether / IP / TCP 192.168.1.1:http > 192.168.1.101:62838 A / HTTP / Raw	
02/11/2024 10:20:26	en0	Ether / IP / TCP 192.168.1.1:http > 192.168.1.101:62838 A / HTTP / Raw	
02/11/2024 10:20:26	en0	Ether / IP / TCP 192.168.1.1:http > 192.168.1.101:62838 A / HTTP / Raw	
02/11/2024 10:20:26	en0	Ether / IP / TCP 192.168.1.1:http > 192.168.1.101:62838 A / HTTP / Raw	
02/11/2024 10:20:26	en0	Ether / IP / TCP 192.168.1.1:http > 192.168.1.101:62838 A / HTTP / Raw	
02/11/2024 10:20:26	en0	Ether / IP / TCP 192.168.1.1:http > 192.168.1.101:62838 A / HTTP / Raw	
02/11/2024 10:20:26	en0	Ether / IP / TCP 192.168.1.1:http > 192.168.1.101:62838 A / HTTP / Raw	
02/11/2024 10:20:26	en0	Ether / IP / TCP 192.168.1.1:http > 192.168.1.101:62838 A / HTTP / Raw	
02/11/2024 10:20:26	en0	Ether / IP / TCP 192.168.1.101:62839 > 192.168.1.1:http SEC	
02/11/2024 10:20:26	en0	Ether / IP / TCP 192.168.1.101:62838 > 192.168.1.1:http A	
02/11/2024 10:20:26	en0	Ether / IP / TCP 192.168.1.1:http > 192.168.1.101:62839 SAE	
02/11/2024 10:20:26	en0	Ether / IP / TCP 192.168.1.101:62840 > 192.168.1.1:http S	
02/11/2024 10:20:26	en0	Ether / IP / TCP 192.168.1.101:62841 > 192.168.1.1:http S	
02/11/2024 10:20:26	en0	Ether / IP / TCP 192.168.1.101:62839 > 192.168.1.1:http A	
02/11/2024 10:20:26	en0	Ether / IP / TCP 192.168.1.101:62842 > 192.168.1.1:http S	
02/11/2024 10:20:26	en0	Ether / IP / TCP 192.168.1.101:62843 > 192.168.1.1:http SEC	
02/11/2024 10:20:26	en0	Ether / IP / TCP / HTTP / GET '/css/main.css' 	
02/11/2024 10:20:26	en0	Ether / IP / TCP 192.168.1.1:http > 192.168.1.101:62838 A / HTTP / Raw	
02/11/2024 10:20:26	en0	Ether / IP / TCP 192.168.1.1:http > 192.168.1.101:62838 A / HTTP / Raw	
02/11/2024 10:20:26	en0	Ether / IP / TCP 192.168.1.1:http > 192.168.1.101:62838 A / HTTP / Raw	
02/11/2024 10:20:26	en0	Ether / IP / TCP 192.168.1.101:62838 > 192.168.1.1:http A	
02/11/2024 10:20:26	en0	Ether / IP / TCP 192.168.1.1:http > 192.168.1.101:62838 A / HTTP / Raw	
02/11/2024 10:20:26	en0	Ether / IP / TCP 192.168.1.1:http > 192.168.1.101:62838 A / HTTP / Raw	
02/11/2024 10:20:26	en0	Ether / IP / TCP 192.168.1.1:http > 192.168.1.101:62838 A / HTTP / Raw	
02/11/2024 10:20:26	en0	Ether / IP / TCP 192.168.1.1:http > 192.168.1.101:62838 A / HTTP / Raw	
02/11/2024 10:20:26	en0	Ether / IP / TCP 192.168.1.1:http > 192.168.1.101:62838 A / HTTP / Raw	
02/11/2024 10:20:26	en0	Ether / IP / TCP 192.168.1.1:http > 192.168.1.101:62838 A / HTTP / Raw	
02/11/2024 10:20:26	en0	Ether / IP / TCP 192.168.1.1:http > 192.168.1.101:62838 A / HTTP / Raw	
02/11/2024 10:20:26	en0	Ether / IP / TCP 192.168.1.1:http > 192.168.1.101:62838 A / HTTP / Raw	
02/11/2024 10:20:26	en0	Ether / IP / TCP 192.168.1.1:http > 192.168.1.101:62838 A / HTTP / Raw	
02/11/2024 10:20:26	en0	Ether / IP / TCP 192.168.1.1:http > 192.168.1.101:62838 A / HTTP / Raw	
02/11/2024 10:20:26	en0	Ether / IP / TCP 192.168.1.1:http > 192.168.1.101:62838 A / HTTP / Raw	
02/11/2024 10:20:26	en0	Ether / IP / TCP 192.168.1.1:http > 192.168.1.101:62838 A / HTTP / Raw	
02/11/2024 10:20:26	en0	Ether / IP / TCP 192.168.1.1:http > 192.168.1.101:62838 A / HTTP / Raw	
02/11/2024 10:20:26	en0	Ether / IP / TCP 192.168.1.1:http > 192.168.1.101:62838 A / HTTP / Raw	
02/11/2024 10:20:26	en0	Ether / IP / TCP 192.168.1.1:http > 192.168.1.101:62838 A / HTTP / Raw	
02/11/2024 10:20:26	en0	Ether / IP / TCP 192.168.1.1:http > 192.168.1.101:62838 A / HTTP / Raw	
02/11/2024 10:20:26	en0	Ether / IP / TCP 192.168.1.1:http > 192.168.1.101:62838 A / HTTP / Raw	
02/11/2024 10:20:26	en0	Ether / IP / TCP 192.168.1.1:http > 192.168.1.101:62838 A / HTTP / Raw	
02/11/2024 10:20:26	en0	Ether / IP / TCP 192.168.1.1:http > 192.168.1.101:62838 A / HTTP / Raw	
02/11/2024 10:20:26	en0	Ether / IP / TCP 192.168.1.1:http > 192.168.1.101:62838 A / HTTP / Raw	
02/11/2024 10:20:26	en0	Ether / IP / TCP 192.168.1.1:http > 192.168.1.101:62838 A / HTTP / Raw	
02/11/2024 10:20:26	en0	Ether / IP / TCP 192.168.1.1:http > 192.168.1.101:62838 A / HTTP / Raw	
02/11/2024 10:20:26	en0	Ether / IP / TCP 192.168.1.101:62838 > 192.168.1.1:http A	
02/11/2024 10:20:26	en0	Ether / IP / TCP 192.168.1.1:http > 192.168.1.101:62838 A / HTTP / Raw	
02/11/2024 10:20:26	en0	Ether / IP / TCP 192.168.1.1:http > 192.168.1.101:62838 A / HTTP / Raw	
02/11/2024 10:20:26	en0	Ether / IP / TCP 192.168.1.1:http > 192.168.1.101:62838 A / HTTP / Raw	
02/11/2024 10:20:26	en0	Ether / IP / TCP 192.168.1.1:http > 192.168.1.101:62838 A / HTTP / Raw	
02/11/2024 10:20:26	en0	Ether / IP / TCP 192.168.1.1:http > 192.168.1.101:62838 A / HTTP / Raw	
02/11/2024 10:20:26	en0	Ether / IP / TCP 192.168.1.1:http > 192.168.1.101:62838 A / HTTP / Raw	
02/11/2024 10:20:26	en0	Ether / IP / TCP 192.168.1.1:http > 192.168.1.101:62838 PA / HTTP / Raw	
02/11/2024 10:20:26	en0	Ether / IP / TCP 192.168.1.1:http > 192.168.1.101:62840 SA	
02/11/2024 10:20:26	en0	Ether / IP / TCP 192.168.1.1:http > 192.168.1.101:62841 SA	
02/11/2024 10:20:26	en0	Ether / IP / TCP 192.168.1.1:http > 192.168.1.101:62842 SA	
02/11/2024 10:20:26	en0	Ether / IP / TCP 192.168.1.1:http > 192.168.1.101:62843 SAE	
02/11/2024 10:20:26	en0	Ether / IP / TCP 192.168.1.1:http > 192.168.1.101:62839 A	
02/11/2024 10:20:26	en0	Ether / IP / TCP 192.168.1.101:62838 > 192.168.1.1:http A	
02/11/2024 10:20:26	en0	Ether / IP / TCP 192.168.1.101:62840 > 192.168.1.1:http A	
02/11/2024 10:20:26	en0	Ether / IP / TCP 192.168.1.101:62841 > 192.168.1.1:http A	
02/11/2024 10:20:26	en0	Ether / IP / TCP / HTTP / GET '/css/login.css' 	
02/11/2024 10:20:26	en0	Ether / IP / TCP / HTTP / GET '/css/jquery.tpInput.css' 	
02/11/2024 10:20:26	en0	Ether / IP / TCP 192.168.1.101:62842 > 192.168.1.1:http A	
02/11/2024 10:20:26	en0	Ether / IP / TCP 192.168.1.101:62843 > 192.168.1.1:http A	
02/11/2024 10:20:26	en0	Ether / IP / TCP / HTTP / 200 OK	
02/11/2024 10:20:26	en0	Ether / IP / TCP / HTTP / GET '/js/jquery-1.8.3.min.js' 	
02/11/2024 10:20:26	en0	Ether / IP / TCP / HTTP / GET '/js/lib.js' 	
02/11/2024 10:20:26	en0	Ether / IP / TCP 192.168.1.101:62839 > 192.168.1.1:http A	
02/11/2024 10:20:26	en0	Ether / IP / TCP / HTTP / GET '/locale/language.js' 	
02/11/2024 10:20:26	en0	Ether / IP / TCP 192.168.1.1:http > 192.168.1.101:62839 A / HTTP / Raw	
02/11/2024 10:20:26	en0	Ether / IP / TCP 192.168.1.1:http > 192.168.1.101:62839 A / HTTP / Raw	
02/11/2024 10:20:26	en0	Ether / IP / TCP 192.168.1.1:http > 192.168.1.101:62839 PA / HTTP / Raw	
02/11/2024 10:20:26	en0	Ether / IP / TCP 192.168.1.101:62839 > 192.168.1.1:http A	
02/11/2024 10:20:26	en0	Ether / IP / TCP 192.168.1.1:http > 192.168.1.101:62839 PA / HTTP / Raw	
02/11/2024 10:20:26	en0	Ether / IP / TCP 192.168.1.101:62839 > 192.168.1.1:http A	
02/11/2024 10:20:26	en0	Ether / IP / TCP 192.168.1.1:http > 192.168.1.101:62840 A	
02/11/2024 10:20:26	en0	Ether / IP / TCP 192.168.1.1:http > 192.168.1.101:62841 A	
02/11/2024 10:20:26	en0	Ether / IP / TCP 192.168.1.1:http > 192.168.1.101:62842 A	
02/11/2024 10:20:26	en0	Ether / IP / TCP 192.168.1.1:http > 192.168.1.101:62843 A	
02/11/2024 10:20:26	en0	Ether / IP / TCP 192.168.1.1:http > 192.168.1.101:62839 A / HTTP / Raw	
02/11/2024 10:20:26	en0	Ether / IP / TCP 192.168.1.1:http > 192.168.1.101:62839 A / HTTP / Raw	
02/11/2024 10:20:26	en0	Ether / IP / TCP 192.168.1.1:http > 192.168.1.101:62839 PA / HTTP / Raw	
02/11/2024 10:20:26	en0	Ether / IP / TCP 192.168.1.101:62839 > 192.168.1.1:http A	
02/11/2024 10:20:26	en0	Ether / IP / TCP 192.168.1.1:http > 192.168.1.101:62839 A / HTTP / Raw	
02/11/2024 10:20:26	en0	Ether / IP / TCP 192.168.1.1:http > 192.168.1.101:62839 A / HTTP / Raw	
02/11/2024 10:20:26	en0	Ether / IP / TCP 192.168.1.1:http > 192.168.1.101:62839 PA / HTTP / Raw	
02/11/2024 10:20:26	en0	Ether / IP / TCP 192.168.1.101:62839 > 192.168.1.1:http A	
02/11/2024 10:20:26	en0	Ether / IP / TCP 192.168.1.1:http > 192.168.1.101:62839 A / HTTP / Raw	
02/11/2024 10:20:26	en0	Ether / IP / TCP 192.168.1.1:http > 192.168.1.101:62839 A / HTTP / Raw	
02/11/2024 10:20:26	en0	Ether / IP / TCP 192.168.1.1:http > 192.168.1.101:62839 PA / HTTP / Raw	
02/11/2024 10:20:26	en0	Ether / IP / TCP 192.168.1.1:http > 192.168.1.101:62839 A / HTTP / Raw	
02/11/2024 10:20:26	en0	Ether / IP / TCP 192.168.1.101:62839 > 192.168.1.1:http A	
02/11/2024 10:20:26	en0	Ether / IP / TCP 192.168.1.1:http > 192.168.1.101:62839 A / HTTP / Raw	
02/11/2024 10:20:26	en0	Ether / IP / TCP 192.168.1.1:http > 192.168.1.101:62839 A / HTTP / Raw	
02/11/2024 10:20:26	en0	Ether / IP / TCP 192.168.1.1:http > 192.168.1.101:62839 A / HTTP / Raw	
02/11/2024 10:20:26	en0	Ether / IP / TCP 192.168.1.1:http > 192.168.1.101:62839 A / HTTP / Raw	
02/11/2024 10:20:26	en0	Ether / IP / TCP 192.168.1.101:62839 > 192.168.1.1:http A	
02/11/2024 10:20:26	en0	Ether / IP / TCP 192.168.1.1:http > 192.168.1.101:62839 A / HTTP / Raw	
02/11/2024 10:20:26	en0	Ether / IP / TCP 192.168.1.1:http > 192.168.1.101:62839 A / HTTP / Raw	
02/11/2024 10:20:26	en0	Ether / IP / TCP 192.168.1.1:http > 192.168.1.101:62839 A / HTTP / Raw	
02/11/2024 10:20:26	en0	Ether / IP / TCP 192.168.1.1:http > 192.168.1.101:62839 A / HTTP / Raw	
02/11/2024 10:20:26	en0	Ether / IP / TCP 192.168.1.1:http > 192.168.1.101:62839 A / HTTP / Raw	
02/11/2024 10:20:26	en0	Ether / IP / TCP 192.168.1.1:http > 192.168.1.101:62839 A / HTTP / Raw	
02/11/2024 10:20:26	en0	Ether / IP / TCP 192.168.1.1:http > 192.168.1.101:62839 A / HTTP / Raw	
02/11/2024 10:20:26	en0	Ether / IP / TCP 192.168.1.1:http > 192.168.1.101:62839 A / HTTP / Raw	
02/11/2024 10:20:26	en0	Ether / IP / TCP 192.168.1.1:http > 192.168.1.101:62839 A / HTTP / Raw	
02/11/2024 10:20:26	en0	Ether / IP / TCP 192.168.1.1:http > 192.168.1.101:62839 A / HTTP / Raw	
02/11/2024 10:20:26	en0	Ether / IP / TCP 192.168.1.1:http > 192.168.1.101:62839 A / HTTP / Raw	
02/11/2024 10:20:26	en0	Ether / IP / TCP 192.168.1.1:http > 192.168.1.101:62839 A / HTTP / Raw	
02/11/2024 10:20:26	en0	Ether / IP / TCP 192.168.1.1:http > 192.168.1.101:62839 A / HTTP / Raw	
02/11/2024 10:20:26	en0	Ether / IP / TCP 192.168.1.1:http > 192.168.1.101:62839 A / HTTP / Raw	
02/11/2024 10:20:26	en0	Ether / IP / TCP 192.168.1.1:http > 192.168.1.101:62839 A / HTTP / Raw	
02/11/2024 10:20:26	en0	Ether / IP / TCP 192.168.1.1:http > 192.168.1.101:62839 PA / HTTP / Raw	
02/11/2024 10:20:26	en0	Ether / IP / TCP 192.168.1.1:http > 192.168.1.101:62839 A / HTTP / Raw	
02/11/2024 10:20:26	en0	Ether / IP / TCP 192.168.1.101:62839 > 192.168.1.1:http A	
02/11/2024 10:20:26	en0	Ether / IP / TCP 192.168.1.1:http > 192.168.1.101:62839 A / HTTP / Raw	
02/11/2024 10:20:26	en0	Ether / IP / TCP 192.168.1.1:http > 192.168.1.101:62839 A / HTTP / Raw	
02/11/2024 10:20:26	en0	Ether / IP / TCP 192.168.1.1:http > 192.168.1.101:62839 A / HTTP / Raw	
02/11/2024 10:20:26	en0	Ether / IP / TCP 192.168.1.1:http > 192.168.1.101:62839 A / HTTP / Raw	
02/11/2024 10:20:26	en0	Ether / IP / TCP 192.168.1.1:http > 192.168.1.101:62839 A / HTTP / Raw	
02/11/2024 10:20:26	en0	Ether / IP / TCP 192.168.1.1:http > 192.168.1.101:62839 A / HTTP / Raw	
02/11/2024 10:20:26	en0	Ether / IP / TCP 192.168.1.1:http > 192.168.1.101:62839 A / HTTP / Raw	
02/11/2024 10:20:26	en0	Ether / IP / TCP 192.168.1.1:http > 192.168.1.101:62839 A / HTTP / Raw	
02/11/2024 10:20:26	en0	Ether / IP / TCP 192.168.1.1:http > 192.168.1.101:62839 A / HTTP / Raw	
02/11/2024 10:20:26	en0	Ether / IP / TCP 192.168.1.1:http > 192.168.1.101:62839 A / HTTP / Raw	
02/11/2024 10:20:26	en0	Ether / IP / TCP 192.168.1.1:http > 192.168.1.101:62839 A / HTTP / Raw	
02/11/2024 10:20:26	en0	Ether / IP / TCP 192.168.1.1:http > 192.168.1.101:62839 A / HTTP / Raw	
02/11/2024 10:20:26	en0	Ether / IP / TCP 192.168.1.1:http > 192.168.1.101:62839 A / HTTP / Raw	
02/11/2024 10:20:26	en0	Ether / IP / TCP 192.168.1.1:http > 192.168.1.101:62839 A / HTTP / Raw	
02/11/2024 10:20:26	en0	Ether / IP / TCP 192.168.1.1:http > 192.168.1.101:62839 A / HTTP / Raw	
02/11/2024 10:20:26	en0	Ether / IP / TCP 192.168.1.1:http > 192.168.1.101:62839 A / HTTP / Raw	
02/11/2024 10:20:26	en0	Ether / IP / TCP 192.168.1.1:http > 192.168.1.101:62839 A / HTTP / Raw	
02/11/2024 10:20:26	en0	Ether / IP / TCP / HTTP / 200 OK / Raw	
02/11/2024 10:20:26	en0	Ether / IP / TCP 192.168.1.1:http > 192.168.1.101:62838 A / HTTP / Raw	
02/11/2024 10:20:26	en0	Ether / IP / TCP 192.168.1.1:http > 192.168.1.101:62838 PA / HTTP / Raw	
02/11/2024 10:20:26	en0	Ether / IP / TCP 192.168.1.101:62839 > 192.168.1.1:http A	
02/11/2024 10:20:26	en0	Ether / IP / TCP 192.168.1.101:62838 > 192.168.1.1:http A	
02/11/2024 10:20:26	en0	Ether / IP / TCP / HTTP / GET '/js/oid_str.js' 	
02/11/2024 10:20:26	en0	Ether / IP / TCP 192.168.1.1:http > 192.168.1.101:62839 A / HTTP / Raw	
02/11/2024 10:20:26	en0	Ether / IP / TCP 192.168.1.1:http > 192.168.1.101:62839 A / HTTP / Raw	
02/11/2024 10:20:26	en0	Ether / IP / TCP 192.168.1.1:http > 192.168.1.101:62839 A / HTTP / Raw	
02/11/2024 10:20:26	en0	Ether / IP / TCP 192.168.1.1:http > 192.168.1.101:62839 A / HTTP / Raw	
02/11/2024 10:20:26	en0	Ether / IP / TCP 192.168.1.1:http > 192.168.1.101:62839 A / HTTP / Raw	
02/11/2024 10:20:26	en0	Ether / IP / TCP 192.168.1.1:http > 192.168.1.101:62839 A / HTTP / Raw	
02/11/2024 10:20:26	en0	Ether / IP / TCP 192.168.1.1:http > 192.168.1.101:62839 A / HTTP / Raw	
02/11/2024 10:20:26	en0	Ether / IP / TCP 192.168.1.1:http > 192.168.1.101:62839 A / HTTP / Raw	
02/11/2024 10:20:26	en0	Ether / IP / TCP 192.168.1.1:http > 192.168.1.101:62839 A / HTTP / Raw	
02/11/2024 10:20:26	en0	Ether / IP / TCP 192.168.1.1:http > 192.168.1.101:62839 A / HTTP / Raw	
02/11/2024 10:20:26	en0	Ether / IP / TCP 192.168.1.1:http > 192.168.1.101:62839 A / HTTP / Raw	
02/11/2024 10:20:26	en0	Ether / IP / TCP 192.168.1.1:http > 192.168.1.101:62839 A / HTTP / Raw	
02/11/2024 10:20:26	en0	Ether / IP / TCP 192.168.1.1:http > 192.168.1.101:62839 A / HTTP / Raw	
02/11/2024 10:20:26	en0	Ether / IP / TCP 192.168.1.1:http > 192.168.1.101:62839 A / HTTP / Raw	
02/11/2024 10:20:26	en0	Ether / IP / TCP 192.168.1.101:62839 > 192.168.1.1:http A	
02/11/2024 10:20:26	en0	Ether / IP / TCP 192.168.1.1:http > 192.168.1.101:62839 A / HTTP / Raw	
02/11/2024 10:20:26	en0	Ether / IP / TCP 192.168.1.1:http > 192.168.1.101:62839 A / HTTP / Raw	
02/11/2024 10:20:26	en0	Ether / IP / TCP 192.168.1.1:http > 192.168.1.101:62839 A / HTTP / Raw	
02/11/2024 10:20:26	en0	Ether / IP / TCP 192.168.1.1:http > 192.168.1.101:62839 A / HTTP / Raw	
02/11/2024 10:20:26	en0	Ether / IP / TCP 192.168.1.1:http > 192.168.1.101:62839 A / HTTP / Raw	
02/11/2024 10:20:26	en0	Ether / IP / TCP 192.168.1.1:http > 192.168.1.101:62839 A / HTTP / Raw	
02/11/2024 10:20:26	en0	Ether / IP / TCP 192.168.1.1:http > 192.168.1.101:62839 A / HTTP / Raw	
02/11/2024 10:20:26	en0	Ether / IP / TCP 192.168.1.1:http > 192.168.1.101:62839 PA / HTTP / Raw	
02/11/2024 10:20:26	en0	Ether / IP / TCP 192.168.1.101:62839 > 192.168.1.1:http A	
02/11/2024 10:20:26	en0	Ether / IP / TCP / HTTP / GET '/js/locale.js' 	
02/11/2024 10:20:26	en0	Ether / IP / TCP / HTTP / 200 OK	
02/11/2024 10:20:26	en0	Ether / IP / TCP 192.168.1.101:62840 > 192.168.1.1:http A	
02/11/2024 10:20:26	en0	Ether / IP / TCP 192.168.1.1:http > 192.168.1.101:62840 A / HTTP / Raw	
02/11/2024 10:20:26	en0	Ether / IP / TCP 192.168.1.1:http > 192.168.1.101:62840 A / HTTP / Raw	
02/11/2024 10:20:26	en0	Ether / IP / TCP 192.168.1.101:62840 > 192.168.1.1:http A	
02/11/2024 10:20:26	en0	Ether / IP / TCP 192.168.1.1:http > 192.168.1.101:62840 PA / HTTP / Raw	
02/11/2024 10:20:26	en0	Ether / IP / TCP 192.168.1.101:62840 > 192.168.1.1:http A	
02/11/2024 10:20:26	en0	Ether / IP / TCP 192.168.1.1:http > 192.168.1.101:62840 A / HTTP / Raw	
02/11/2024 10:20:26	en0	Ether / IP / TCP 192.168.1.1:http > 192.168.1.101:62840 A / HTTP / Raw	
02/11/2024 10:20:26	en0	Ether / IP / TCP 192.168.1.1:http > 192.168.1.101:62840 PA / HTTP / Raw	
02/11/2024 10:20:26	en0	Ether / IP / TCP 192.168.1.1:http > 192.168.1.101:62840 A / HTTP / Raw	
02/11/2024 10:20:26	en0	Ether / IP / TCP 192.168.1.1:http > 192.168.1.101:62840 A / HTTP / Raw	
02/11/2024 10:20:26	en0	Ether / IP / TCP 192.168.1.1:http > 192.168.1.101:62840 PA / HTTP / Raw	
02/11/2024 10:20:26	en0	Ether / IP / TCP 192.168.1.1:http > 192.168.1.101:62840 A / HTTP / Raw	
02/11/2024 10:20:26	en0	Ether / IP / TCP 192.168.1.1:http > 192.168.1.101:62840 A / HTTP / Raw	
02/11/2024 10:20:26	en0	Ether / IP / TCP 192.168.1.101:62840 > 192.168.1.1:http A	
02/11/2024 10:20:26	en0	Ether / IP / TCP / HTTP / 200 OK / Raw	
02/11/2024 10:20:26	en0	Ether / IP / TCP 192.168.1.1:http > 192.168.1.101:62841 PA / HTTP / Raw	
02/11/2024 10:20:26	en0	Ether / IP / TCP 192.168.1.101:62841 > 192.168.1.1:http A	
02/11/2024 10:20:26	en0	Ether / IP / TCP / HTTP / GET '/js/encrypt.js' 	
02/11/2024 10:20:26	en0	Ether / IP / TCP 192.168.1.1:http > 192.168.1.101:62840 A / HTTP / Raw	
02/11/2024 10:20:26	en0	Ether / IP / TCP 192.168.1.1:http > 192.168.1.101:62840 A / HTTP / Raw	
02/11/2024 10:20:26	en0	Ether / IP / TCP 192.168.1.1:http > 192.168.1.101:62840 A / HTTP / Raw	
02/11/2024 10:20:26	en0	Ether / IP / TCP 192.168.1.101:62840 > 192.168.1.1:http A	
02/11/2024 10:20:26	en0	Ether / IP / TCP 192.168.1.1:http > 192.168.1.101:62840 A / HTTP / Raw	
02/11/2024 10:20:26	en0	Ether / IP / TCP 192.168.1.1:http > 192.168.1.101:62840 A / HTTP / Raw	
02/11/2024 10:20:26	en0	Ether / IP / TCP 192.168.1.1:http > 192.168.1.101:62840 A / HTTP / Raw	
02/11/2024 10:20:26	en0	Ether / IP / TCP 192.168.1.101:62840 > 192.168.1.1:http A	
02/11/2024 10:20:26	en0	Ether / IP / TCP / HTTP / 200 OK	
02/11/2024 10:20:26	en0	Ether / IP / TCP 192.168.1.1:http > 192.168.1.101:62838 A / HTTP / Raw	
02/11/2024 10:20:26	en0	Ether / IP / TCP 192.168.1.1:http > 192.168.1.101:62838 A / HTTP / Raw	
02/11/2024 10:20:26	en0	Ether / IP / TCP 192.168.1.1:http > 192.168.1.101:62838 PA / HTTP / Raw	
02/11/2024 10:20:26	en0	Ether / IP / TCP 192.168.1.1:http > 192.168.1.101:62838 A / HTTP / Raw	
02/11/2024 10:20:26	en0	Ether / IP / TCP 192.168.1.1:http > 192.168.1.101:62838 A / HTTP / Raw	
02/11/2024 10:20:26	en0	Ether / IP / TCP 192.168.1.1:http > 192.168.1.101:62838 PA / HTTP / Raw	
02/11/2024 10:20:26	en0	Ether / IP / TCP 192.168.1.1:http > 192.168.1.101:62838 A / HTTP / Raw	
02/11/2024 10:20:26	en0	Ether / IP / TCP 192.168.1.1:http > 192.168.1.101:62838 A / HTTP / Raw	
02/11/2024 10:20:26	en0	Ether / IP / TCP 192.168.1.1:http > 192.168.1.101:62838 PA / HTTP / Raw	
02/11/2024 10:20:26	en0	Ether / IP / TCP 192.168.1.1:http > 192.168.1.101:62838 A / HTTP / Raw	
02/11/2024 10:20:26	en0	Ether / IP / TCP 192.168.1.1:http > 192.168.1.101:62838 A / HTTP / Raw	
02/11/2024 10:20:26	en0	Ether / IP / TCP 192.168.1.1:http > 192.168.1.101:62838 PA / HTTP / Raw	
02/11/2024 10:20:26	en0	Ether / IP / TCP 192.168.1.1:http > 192.168.1.101:62838 A / HTTP / Raw	
02/11/2024 10:20:26	en0	Ether / IP / TCP 192.168.1.1:http > 192.168.1.101:62838 A / HTTP / Raw	
02/11/2024 10:20:26	en0	Ether / IP / TCP 192.168.1.1:http > 192.168.1.101:62838 PA / HTTP / Raw	
02/11/2024 10:20:26	en0	Ether / IP / TCP 192.168.1.1:http > 192.168.1.101:62840 A / HTTP / Raw	
02/11/2024 10:20:26	en0	Ether / IP / TCP 192.168.1.1:http > 192.168.1.101:62840 A / HTTP / Raw	
02/11/2024 10:20:26	en0	Ether / IP / TCP 192.168.1.1:http > 192.168.1.101:62840 A / HTTP / Raw	
02/11/2024 10:20:26	en0	Ether / IP / TCP 192.168.1.101:62838 > 192.168.1.1:http A	
02/11/2024 10:20:26	en0	Ether / IP / TCP 192.168.1.101:62838 > 192.168.1.1:http A	
02/11/2024 10:20:26	en0	Ether / IP / TCP 192.168.1.101:62840 > 192.168.1.1:http A	
02/11/2024 10:20:26	en0	Ether / IP / TCP 192.168.1.1:http > 192.168.1.101:62840 PA / HTTP / Raw	
02/11/2024 10:20:26	en0	Ether / IP / TCP 192.168.1.1:http > 192.168.1.101:62841 A	
02/11/2024 10:20:26	en0	Ether / IP / TCP 192.168.1.101:62840 > 192.168.1.1:http A	
02/11/2024 10:20:26	en0	Ether / IP / TCP / HTTP / GET '/js/jquery.tpInput.js' 	
02/11/2024 10:20:26	en0	Ether / IP / TCP 192.168.1.1:http > 192.168.1.101:62840 A	
02/11/2024 10:20:26	en0	Ether / IP / TCP 192.168.1.1:http > 192.168.1.101:62838 A / HTTP / Raw	
02/11/2024 10:20:26	en0	Ether / IP / TCP 192.168.1.1:http > 192.168.1.101:62838 A / HTTP / Raw	
02/11/2024 10:20:26	en0	Ether / IP / TCP 192.168.1.1:http > 192.168.1.101:62838 PA / HTTP / Raw	
02/11/2024 10:20:26	en0	Ether / IP / TCP 192.168.1.101:62838 > 192.168.1.1:http A	
02/11/2024 10:20:26	en0	Ether / IP / TCP 192.168.1.1:http > 192.168.1.101:62838 A / HTTP / Raw	
02/11/2024 10:20:26	en0	Ether / IP / TCP 192.168.1.1:http > 192.168.1.101:62838 A / HTTP / Raw	
02/11/2024 10:20:26	en0	Ether / IP / TCP 192.168.1.1:http > 192.168.1.101:62838 PA / HTTP / Raw	
02/11/2024 10:20:26	en0	Ether / IP / TCP 192.168.1.101:62838 > 192.168.1.1:http A	
02/11/2024 10:20:26	en0	Ether / IP / TCP 192.168.1.1:http > 192.168.1.101:62838 A / HTTP / Raw	
02/11/2024 10:20:26	en0	Ether / IP / TCP 192.168.1.1:http > 192.168.1.101:62838 A / HTTP / Raw	
02/11/2024 10:20:26	en0	Ether / IP / TCP 192.168.1.1:http > 192.168.1.101:62838 PA / HTTP / Raw	
02/11/2024 10:20:26	en0	Ether / IP / TCP 192.168.1.101:62838 > 192.168.1.1:http A	
02/11/2024 10:20:26	en0	Ether / IP / TCP 192.168.1.1:http > 192.168.1.101:62838 A / HTTP / Raw	
02/11/2024 10:20:26	en0	Ether / IP / TCP 192.168.1.1:http > 192.168.1.101:62838 A / HTTP / Raw	
